{
  "title": "AI 产品组合策略",
  "goal": "面向管理层说明 AI 产品组合的优先级、投入节奏和落地路径",
  "audience": "管理层",
  "owner": "产品策略团队",
  "randomSeed": "theme10-example",
  "pageCount": 5,
  "themePack": "theme10",
  "slides": [
    {
      "layout": "theme10_page001",
      "props": {
        "kicker": "示例封面",
        "title": "AI 产品组合策略",
        "subtitle": "面向管理层说明 AI 产品组合的优先级、投入节奏和落地路径",
        "lead": "面向管理层说明 AI 产品组合的优先级、投入节奏和落地路径",
        "note": "管理层 / 产品策略团队"
      }
    },
    {
      "layout": "theme10_page006",
      "props": {
        "kicker": "示例页面 2",
        "title": "AI 产品组合策略 · 2",
        "subtitle": "面向管理层说明 AI 产品组合的优先级、投入节奏和落地路径",
        "lead": "面向管理层说明 AI 产品组合的优先级、投入节奏和落地路径",
        "note": "管理层 / 产品策略团队"
      }
    },
    {
      "layout": "theme10_page021",
      "props": {
        "kicker": "示例页面 3",
        "title": "AI 产品组合策略 · 3",
        "subtitle": "面向管理层说明 AI 产品组合的优先级、投入节奏和落地路径",
        "lead": "面向管理层说明 AI 产品组合的优先级、投入节奏和落地路径",
        "note": "管理层 / 产品策略团队"
      }
    },
    {
      "layout": "theme10_page044",
      "props": {
        "kicker": "示例页面 4",
        "title": "AI 产品组合策略 · 4",
        "subtitle": "面向管理层说明 AI 产品组合的优先级、投入节奏和落地路径",
        "lead": "面向管理层说明 AI 产品组合的优先级、投入节奏和落地路径",
        "note": "管理层 / 产品策略团队"
      }
    },
    {
      "layout": "theme10_page095",
      "props": {
        "kicker": "示例页面 5",
        "title": "AI 产品组合策略 · 5",
        "subtitle": "面向管理层说明 AI 产品组合的优先级、投入节奏和落地路径",
        "lead": "面向管理层说明 AI 产品组合的优先级、投入节奏和落地路径",
        "note": "管理层 / 产品策略团队"
      }
    }
  ]
}
